{
  "version": 1,
  "compatibility": "Experimental source API v1 with additive 1.1 UI services; descriptor layout unchanged, no external binary ABI. NAVIGATE x/y are direction signs, MOVE/ACTIVATE are pixels. One trusted foreground app; 24 widgets; no heap API. B exits normal/maximized unless an app intercepts Back; every foreground app supports held Start+B or app Exit. Additive 1.2 session RAM files and shared text/canvas controls; guarded close for dirty maximized editors. Additive 1.3 VFS drive capabilities/version negotiation; original file names and whole-file write semantics retained. Backends private. Additive 1.4 trusted bundled XGM2 media service and fixed RAM Music directory; external playback unavailable. Additive 1.5 variable 16-colour tile canvas, dedicated PAL2, integer zoom/pan; legacy canvas remains supported. Additive 1.6 compact shared chrome and one-row menus; query client/content rectangles after resize, never assume fixed header offsets. Additive 1.7 copied custom cursor bitmaps/hotspots and centred brush markers; descriptor layout remains unchanged.",
  "types": "typedef int16_t MB_Result;\nenum { MB_OK = 0, MB_INVALID = -1, MB_BUSY = -2, MB_VERSION = -3 };\nenum { MB_CAP_CONTROLLER = 1, MB_CAP_ROM_LINKED = 2 };\ntypedef enum { MB_MOVE, MB_ACTIVATE, MB_BACK, MB_CONTEXT, MB_MENU, MB_NAVIGATE, MB_RESIZE, MB_MODE_CHANGED, MB_DISPLAY_LOST, MB_DISPLAY_RESTORED, MB_THEME_CHANGED, MB_FOCUS, MB_OPEN, MB_CLOSE, MB_CLOSE_REQUEST } MB_Action;\ntypedef struct { MB_Action action; int16_t x, y; } MB_Event;\ntypedef struct {\n    uint16_t version;\n    const char *name;\n    MB_Result (*init)(void);\n    void (*activate)(void);\n    void (*event)(const MB_Event *event);\n    void (*tick)(void);\n    void (*deactivate)(void);\n    void (*shutdown)(void);\n} MB_App;\n\nenum { MB_UNAVAILABLE=-4, MB_NOT_FOUND=-5, MB_OVERFLOW=-6, MB_DIV_ZERO=-7 };\nenum { MB_CAP_PSG=4, MB_CAP_ROM_VOLUME=8 };\nenum { MB_APP_RESERVED=0, MB_APP_SYSTEM=1, MB_APP_ABOUT=2, MB_APP_CALCULATOR=3, MB_APP_CLOCK=4, MB_APP_SOUND=5, MB_APP_SNAKE=6, MB_APP_MEGABOUNCE=7, MB_APP_COLOURSTORM=8, MB_APP_OCEAN=9, MB_APP_STARDRIVE=10, MB_APP_MEGAPAD=11, MB_APP_MEGAPAINT=12, MB_APP_MEGAPLAYER=13, MB_APP_COUNT=14 };\nenum { MB_INPUT_FOCUS=0, MB_INPUT_POINTER=1, MB_INPUT_GAME=2 };\nenum { MB_KEY_UP=1, MB_KEY_DOWN=2, MB_KEY_LEFT=4, MB_KEY_RIGHT=8, MB_KEY_A=16, MB_KEY_B=32, MB_KEY_C=64, MB_KEY_START=128 };\nenum { MB_MEMORY_SGDK_HEAP=1, MB_VOLUME_READ_ONLY=1, MB_UI_ENABLED=1 };\nenum { MB_STYLE_SURFACE=0, MB_STYLE_INK=1, MB_STYLE_ACCENT=2, MB_STYLE_TITLE=3, MB_STYLE_DESKTOP=4 };\ntypedef struct { uint16_t version, total_tracked, used, free, high_water, scope, static_bytes, stack_reserved, stack_used, stack_guard_ok; } MB_MemoryStats;\ntypedef struct { uint16_t api_version, refresh_hz, pal; const char *version; const char *credits; const char *license; } MB_SystemInfo;\ntypedef struct { uint16_t buttons, mode; int16_t x, y; } MB_Input;\ntypedef struct { uint16_t id; const char *name; } MB_AppInfo;\ntypedef struct { const char *name; uint16_t flags; uint32_t capacity_bytes; } MB_Volume;\ntypedef struct { uint16_t version, heap_total, heap_used, heap_free, heap_high_water, static_bytes, stack_reserved, stack_used, stack_guard_ok, work_last, work_max, transition_max, dirty_cells, tiles, refresh_hz, app_id, launch_count, close_count, audio_active; } MB_Diagnostics;\n\ntypedef enum { MB_WINDOW_NORMAL, MB_WINDOW_MAXIMIZED, MB_WINDOW_FULLSCREEN } MB_WindowMode;\ntypedef struct { uint16_t x, y, width, height; } MB_Rect;\ntypedef enum { MB_THEME_BLUE, MB_THEME_GRAPHITE, MB_THEME_FOREST, MB_THEME_AMBER, MB_THEME_OCEAN, MB_THEME_COUNT } MB_ThemeId;\ntypedef struct { uint16_t lines; } MB_PaletteRequest;\ntypedef struct { uint16_t token, lines, first_tile, tile_count, sprite_count; } MB_PaletteLease;\nenum { MB_UI_MENU_OPEN=2, MB_UI_MENU_DISMISS=65533, MB_UI_EXIT=65534 };\n\ntypedef struct { uint16_t loaded_tiles, queue_tiles, sprite_count, transfer_last, transfer_peak, band_peak; } MB_GraphicsStats;\n\nenum { MB_NO_SPACE=-8, MB_EXISTS=-9, MB_LIMIT=-10, MB_CORRUPT=-11 };\nenum { MB_DIR_DOCUMENTS=0, MB_DIR_PICTURES=1, MB_FILE_READ=1, MB_FILE_WRITE=2, MB_FILE_CREATE=4 };\ntypedef uint16_t MB_FileHandle;\ntypedef struct { uint16_t version, directory, size; char name[20]; uint16_t flags; } MB_FileInfo;\ntypedef struct { uint16_t version, reserved_bytes, capacity, used, free, files, max_files, max_handles; } MB_FSInfo;\nenum { MB_TEXT_NONE=0, MB_TEXT_CHAR=1, MB_TEXT_BACKSPACE=2, MB_TEXT_DELETE=3, MB_TEXT_ENTER=4, MB_TEXT_LEFT=5, MB_TEXT_RIGHT=6, MB_TEXT_DONE=7, MB_TEXT_CANCEL=8 };\ntypedef struct { uint16_t action; uint8_t character; } MB_TextInput;\nenum { /** Reserved drive or unsupported operation; no backend is available. */ MB_NOT_SUPPORTED=-12, /** Mutation attempted on a read-only mount. */ MB_READ_ONLY=-13, /** Backend read/program/sync/close failed; check every result. */ MB_IO=-14 };\nenum { /** Files may be read; mutations are rejected. */ MB_FS_READ_ONLY=1, /** Backend accepts writes subject to capacity and permissions. */ MB_FS_WRITABLE=2, /** Files are lost on console reset or power-off. */ MB_FS_VOLATILE=4, /** Backend supports persistence; no current writable mount sets this. */ MB_FS_PERSISTENT=8, /** Directory enumeration supported; consult fixed-directory limits. */ MB_FS_DIRECTORIES=16, /** Explicit bounded read offsets supported; no shared seek cursor. */ MB_FS_OFFSET_READ=32, /** Same-mount rename supported, subject to directory restrictions. */ MB_FS_RENAME=64, /** Free bytes report exact remaining payload capacity. */ MB_FS_SPACE_EXACT=128, /** Backend currently available. */ MB_FS_MOUNTED=256, /** Whole-file write validates before replacing existing contents. */ MB_FS_ATOMIC_REPLACE=512, /** Immutable resources linked into the ROM. */ MB_FS_BUNDLED=1024 };\nenum { /** Entry describes a fixed directory. */ MB_FILE_DIRECTORY=1, /** Entry describes a regular file. */ MB_FILE_REGULAR=2, /** This entry cannot be modified. */ MB_FILE_READ_ONLY=4 };\n/** VFS descriptor v1. Borrowed names live for the boot. Byte counts distinguish reserved storage from file payload; ROM free is zero. */\r\ntypedef struct { uint16_t version, id, capabilities, max_files, max_handles; uint32_t reserved_bytes, capacity, used, free; const char *name; const char *backend; } MB_DriveInfo;\n/** Music catalog uses trusted ROM assets; external compiled playback is unavailable. */\nenum { MB_MUSIC_STOPPED=0, MB_MUSIC_PLAYING=1, MB_MUSIC_ERROR=2 };\nenum { MB_MUSIC_BUNDLED=1, MB_MUSIC_EXTERNAL=2 };\nenum { MB_DIR_MUSIC=2 };\ntypedef struct { uint16_t version, id; uint32_t bytes; const char *title; const char *credit; } MB_MusicTrack;\n/** Borrowed immutable source description; pixel callback executes in bounded foreground video flush, never in an interrupt. */\ntypedef struct { uint16_t version, width, height; const void *context; uint8_t (*pixel)(const void *context, uint16_t x, uint16_t y); void (*tile)(const void *context, uint16_t x, uint16_t y, uint32_t *rows); } MB_CanvasSource;\n\n/** Copied custom cursor: 1..16 screen pixels per axis; each row holds 16 left-aligned 2-bit pixels (0 transparent, 1 ink, 2 light, 3 accent). */\nenum { MB_CURSOR_CLIENT=0, MB_CURSOR_CANVAS=1 };\ntypedef struct { uint16_t width, height, hotspot_x, hotspot_y; uint32_t rows[16]; } MB_Cursor;\n",
  "functions": [
    {
      "id": "app.launch",
      "family": "app",
      "purpose": "Launch one statically linked foreground app; init failure leaves desktop active.",
      "signature": "MB_Result mb_app_launch(const MB_App *app)",
      "arguments": "ROM-resident descriptor; version 1; name and all callbacks required.",
      "parameters": {
        "app": "Borrowed ROM-resident descriptor; version 1, name and every lifecycle callback required."
      },
      "returns": "MB_OK, MB_INVALID, MB_BUSY, MB_VERSION, or init error.",
      "errors": "Null fields invalid; second launch busy; unsupported version rejected.",
      "ownership": "Descriptor borrowed until close; event pointers valid only during callback.",
      "timing": "Foreground only; synchronous; lifecycle callbacks must return promptly; nested lifecycle calls return MB_BUSY. Prefer launch_id for callbacks.",
      "capability": "MB_CAP_ROM_LINKED; no external loading.",
      "edges": "Repeated launch/close; shutdown follows successful init only.",
      "negative": "Null descriptor, missing callback, incompatible version, failed init, busy runtime.",
      "example": "mb_app_launch(&clock_app);"
    },
    {
      "id": "app.close",
      "family": "app",
      "purpose": "Close foreground app, release its widgets, silence owned PSG and restore desktop; safe to request from events.",
      "signature": "void mb_app_close(void)",
      "arguments": "None.",
      "parameters": {
      },
      "returns": "None.",
      "errors": "No active app is a no-op.",
      "ownership": "Releases borrowed descriptor after shutdown.",
      "timing": "Foreground; deferred when called from event/tick callbacks; forbidden inside init/activate/deactivate/shutdown callbacks.",
      "capability": "MB_CAP_ROM_LINKED.",
      "edges": "Repeated close is harmless.",
      "negative": "Close when idle.",
      "example": "mb_app_close();"
    },
    {
      "id": "system.capabilities",
      "family": "system",
      "purpose": "Report proven baseline services.",
      "signature": "uint16_t mb_system_capabilities(void)",
      "arguments": "None.",
      "parameters": {
      },
      "returns": "Controller, ROM-linked app, read-only ROM-volume metadata and PSG flags; no SRAM/RTC/network.",
      "errors": "None.",
      "ownership": "Value.",
      "timing": "Bounded synchronous query; safe in app callbacks.",
      "capability": "Always available; no SRAM, RTC, mouse or network advertised.",
      "edges": "Bitmask permits future additions.",
      "negative": "Do not infer writable storage from flags.",